{
  "url": "https://gitlab.com/example",
  "name": "Example Project",
  "description": "Example description",
  "secret_token": "glpat-example-token",
  "enable_ssl_verification": true,
  "push_events": true,
  "tag_push_events": true,
  "issues_events": true,
  "confidential_issues_events": true,
  "merge_requests_events": true
}